{
  "schema_version": "auto_result_v1",
  "status": "blocked",
  "outcome": "blocked",
  "timezone": "Asia/Hong_Kong",
  "observed_at_hk": "1970-01-01T00:00:00+08:00",
  "slot_date": "1970-01-01",
  "slot_start": "1970-01-01T12:00:00+08:00",
  "slot_end": "1970-01-02T12:00:00+08:00",
  "workflow_refs": [],
  "skill_run_ids": [],
  "output_ids": [],
  "external_action_ids": [],
  "provider_calls": 0,
  "next_slot_at": "1970-01-02T12:00:00+08:00",
  "warnings": ["synthetic_template"]
}
